{
  "rules": [],
  "no_elections_reason": "The Chechen Republic of Ichkeria held no national elections after January-February 1997. From 2000 its leadership was an insurgent government and government-in-exile at war with Russia, and it was abolished by its own acting president on 31 October 2007 (President of Ichkeria article).",
  "elections": [],
  "source": [
    { "url": "https://en.wikipedia.org/wiki/President_of_the_Chechen_Republic_of_Ichkeria", "title": "Wikipedia: President of the Chechen Republic of Ichkeria", "accessed": "2026-10-16" },
    { "url": "https://en.wikipedia.org/wiki/Parliament_of_the_Chechen_Republic_of_Ichkeria", "title": "Wikipedia: Parliament of the Chechen Republic of Ichkeria", "accessed": "2026-10-16" }
  ],
  "confidence": "verified"
}
