{
  "rules": [],
  "no_elections_reason": "The SDF held no elections itself; elections in the areas of the Democratic Autonomous Administration are not modelled here.",
  "elections": [],
  "source": [
    {
      "url": "https://en.wikipedia.org/wiki/Syrian_Democratic_Forces",
      "title": "Wikipedia: Syrian Democratic Forces",
      "accessed": "2026-10-20"
    },
    {
      "url": "https://en.wikipedia.org/wiki/Mazloum_Abdi",
      "title": "Wikipedia: Mazloum Abdi",
      "accessed": "2026-10-20"
    },
    {
      "url": "https://www.wikidata.org/wiki/Q59727981",
      "title": "Wikidata: Mazloum Abdi",
      "accessed": "2026-10-20"
    }
  ],
  "confidence": "needs_review",
  "review_note": "No results recorded; check the article if elections are ever modelled."
}
