{
  "rules": [],
  "no_elections_reason": "This record models Hamas as an armed group; Palestinian elections are under PSE.",
  "elections": [],
  "source": [
    {
      "url": "https://en.wikipedia.org/wiki/Hamas_Political_Bureau",
      "title": "Wikipedia: Hamas Political Bureau",
      "accessed": "2026-10-20"
    }
  ],
  "confidence": "verified"
}
