{
  "rules": [],
  "no_elections_reason": "This record models Hezbollah as an armed group; Lebanese elections are under LBN.",
  "elections": [],
  "source": [
    {
      "url": "https://en.wikipedia.org/wiki/Secretary-General_of_Hezbollah",
      "title": "Wikipedia: Secretary-General of Hezbollah",
      "accessed": "2026-10-20"
    }
  ],
  "confidence": "verified"
}
