{
  "rules": [],
  "no_elections_reason": "The republic held elections that were not recognised internationally; their results are not recorded here.",
  "elections": [],
  "source": [
    {
      "url": "https://en.wikipedia.org/wiki/Luhansk_People's_Republic",
      "title": "Wikipedia: Luhansk People's Republic",
      "accessed": "2026-10-20"
    },
    {
      "url": "https://en.wikipedia.org/wiki/Igor_Plotnitsky",
      "title": "Wikipedia: Igor Plotnitsky",
      "accessed": "2026-10-20"
    },
    {
      "url": "https://www.wikidata.org/wiki/Q43590358",
      "title": "Wikidata: Leonid Pasechnik",
      "accessed": "2026-10-20"
    },
    {
      "url": "https://www.wikidata.org/wiki/Q17582456",
      "title": "Wikidata: Igor Plotnitsky",
      "accessed": "2026-10-20"
    },
    {
      "url": "https://www.wikidata.org/wiki/Q16745486",
      "title": "Wikidata: Valery Bolotov",
      "accessed": "2026-10-20"
    }
  ],
  "confidence": "needs_review",
  "review_note": "No results recorded; check the article if elections are ever modelled."
}
